ID,Title,URL,Is Premium,Acceptance %,Difficulty,Frequency %,Topics
146,LRU Cache,/problems/lru-cache,N,40.5%,Medium,100.00%,"Hash Table, Linked List, Design, Doubly-Linked List"
42,Trapping Rain Water,/problems/trapping-rain-water,N,48.9%,Hard,0.01%,No Topics Found
49,Group Anagrams,/problems/group-anagrams,N,56.9%,Medium,0.01%,"Array, Hash Table, String, Sorting"
200,Number of Islands,/problems/number-of-islands,N,46.8%,Medium,0.01%,"Array, Depth-First Search, Breadth-First Search, Union Find, Matrix"
206,Reverse Linked List,/problems/reverse-linked-list,N,62.5%,Easy,0.01%,"Linked List, Recursion"
977,Squares of a Sorted Array,/problems/squares-of-a-sorted-array,N,72.1%,Easy,0.00%,"Array, Two Pointers, Sorting"
