ID,Title,URL,Is Premium,Acceptance %,Difficulty,Frequency %,Topics
819,Most Common Word,/problems/most-common-word,N,44.8%,Easy,0.01%,"Array, Hash Table, String, Counting"
905,Sort Array By Parity,/problems/sort-array-by-parity,N,74.1%,Easy,0.01%,"Array, Two Pointers, Sorting"
621,Task Scheduler,/problems/task-scheduler,N,50.1%,Medium,0.01%,"Array, Hash Table, Greedy, Sorting, Heap (Priority Queue), Counting"
28,Implement strStr(),/problems/implement-strstr,N,34.5%,Easy,0.01%,"Two Pointers, String, String Matching"
8,String to Integer (atoi),/problems/string-to-integer-atoi,N,15.4%,Medium,0.01%,String
153,Find Minimum in Rotated Sorted Array,/problems/find-minimum-in-rotated-sorted-array,N,45.1%,Medium,0.01%,"Array, Binary Search"
977,Squares of a Sorted Array,/problems/squares-of-a-sorted-array,N,72.1%,Easy,0.00%,"Array, Two Pointers, Sorting"
67,Add Binary,/problems/add-binary,N,45.2%,Easy,0.00%,No Topics Found
140,Word Break II,/problems/word-break-ii,N,32.6%,Hard,0.00%,No Topics Found
1380,Lucky Numbers in a Matrix,/problems/lucky-numbers-in-a-matrix,N,71.5%,Easy,0.00%,No Topics Found
1410,HTML Entity Parser,/problems/html-entity-parser,N,54.0%,Medium,0.00%,"Hash Table, String"
