ID,Title,URL,Is Premium,Acceptance %,Difficulty,Frequency %,Topics
1,Two Sum,/problems/two-sum,N,49.1%,Easy,1.93%,"Array, Hash Table"
3,Longest Substring Without Repeating Characters,/problems/longest-substring-without-repeating-characters,N,33.8%,Medium,4.55%,"Hash Table, String, Sliding Window"
20,Valid Parentheses,/problems/valid-parentheses,N,40.6%,Easy,5.07%,"String, Stack"
190,Reverse Bits,/problems/reverse-bits,N,52.4%,Easy,41.33%,"Divide and Conquer, Bit Manipulation"
191,Number of 1 Bits,/problems/number-of-1-bits,N,65.0%,Easy,70.67%,"Divide and Conquer, Bit Manipulation"
236,Lowest Common Ancestor of a Binary Tree,/problems/lowest-common-ancestor-of-a-binary-tree,N,58.1%,Medium,29.57%,"Tree, Depth-First Search, Binary Tree"
509,Fibonacci Number,/problems/fibonacci-number,N,69.2%,Easy,14.57%,"Math, Dynamic Programming, Recursion, Memoization"
1986,Minimum Number of Work Sessions to Finish the Tasks,/problems/minimum-number-of-work-sessions-to-finish-the-tasks,N,33.1%,Medium,100.00%,"Array, Dynamic Programming, Backtracking, Bit Manipulation, Bitmask"
160,Intersection of Two Linked Lists,/problems/intersection-of-two-linked-lists,N,40.6%,Easy,0.06%,No Topics Found
206,Reverse Linked List,/problems/reverse-linked-list,N,62.5%,Easy,0.04%,"Linked List, Recursion"
72,Edit Distance,/problems/edit-distance,N,44.8%,Hard,0.04%,No Topics Found
237,Delete Node in a Linked List,/problems/delete-node-in-a-linked-list,N,63.8%,Easy,0.03%,Linked List
2,Add Two Numbers,/problems/add-two-numbers,N,33.9%,Medium,0.02%,"Linked List, Math, Recursion"
283,Move Zeroes,/problems/move-zeroes,N,57.8%,Easy,0.02%,"Array, Two Pointers"
151,Reverse Words in a String,/problems/reverse-words-in-a-string,N,21.9%,Medium,0.01%,"Two Pointers, String"
53,Maximum Subarray,/problems/maximum-subarray,N,46.5%,Easy,0.01%,"Array, Divide and Conquer, Dynamic Programming"
1183,Maximum Number of Ones,/problems/maximum-number-of-ones,N,54.5%,Hard,0.00%,No Topics Found
