ID,Title,URL,Is Premium,Acceptance %,Difficulty,Frequency %,Topics
3,Longest Substring Without Repeating Characters,/problems/longest-substring-without-repeating-characters,N,33.8%,Medium,1.73%,"Hash Table, String, Sliding Window"
4,Median of Two Sorted Arrays,/problems/median-of-two-sorted-arrays,N,35.3%,Hard,0.67%,"Array, Binary Search, Divide and Conquer"
11,Container With Most Water,/problems/container-with-most-water,N,54.3%,Medium,0.55%,"Array, Two Pointers, Greedy"
13,Roman to Integer,/problems/roman-to-integer,N,58.2%,Easy,0.32%,"Hash Table, Math, String"
15,3Sum,/problems/3sum,N,32.3%,Medium,0.45%,"Array, Two Pointers, Sorting"
22,Generate Parentheses,/problems/generate-parentheses,N,71.9%,Medium,2.58%,"String, Dynamic Programming, Backtracking"
23,Merge k Sorted Lists,/problems/merge-k-sorted-lists,N,48.5%,Hard,1.30%,"Linked List, Divide and Conquer, Heap (Priority Queue), Merge Sort"
25,Reverse Nodes in k-Group,/problems/reverse-nodes-in-k-group,N,53.7%,Hard,4.91%,"Linked List, Recursion"
33,Search in Rotated Sorted Array,/problems/search-in-rotated-sorted-array,N,38.7%,Medium,0.68%,"Array, Binary Search"
37,Sudoku Solver,/problems/sudoku-solver,N,56.8%,Hard,3.87%,"Array, Hash Table, Backtracking, Matrix"
41,First Missing Positive,/problems/first-missing-positive,N,36.6%,Hard,1.64%,"Array, Hash Table"
46,Permutations,/problems/permutations,N,74.9%,Medium,1.12%,"Array, Backtracking"
49,Group Anagrams,/problems/group-anagrams,N,66.5%,Medium,0.85%,"Array, Hash Table, String, Sorting"
54,Spiral Matrix,/problems/spiral-matrix,N,43.8%,Medium,1.22%,"Array, Matrix, Simulation"
56,Merge Intervals,/problems/merge-intervals,N,46.0%,Medium,0.91%,"Array, Sorting"
62,Unique Paths,/problems/unique-paths,N,62.3%,Medium,1.17%,"Math, Dynamic Programming, Combinatorics"
79,Word Search,/problems/word-search,N,39.8%,Medium,8.25%,"Array, String, Backtracking, Matrix"
91,Decode Ways,/problems/decode-ways,N,32.3%,Medium,14.45%,"String, Dynamic Programming"
93,Restore IP Addresses,/problems/restore-ip-addresses,N,43.5%,Medium,15.12%,"String, Backtracking"
124,Binary Tree Maximum Path Sum,/problems/binary-tree-maximum-path-sum,N,38.5%,Hard,1.90%,"Dynamic Programming, Tree, Depth-First Search, Binary Tree"
131,Palindrome Partitioning,/problems/palindrome-partitioning,N,62.5%,Medium,3.12%,"String, Dynamic Programming, Backtracking"
139,Word Break,/problems/word-break,N,45.5%,Medium,1.57%,"Array, Hash Table, String, Dynamic Programming, Trie, Memoization"
146,LRU Cache,/problems/lru-cache,N,40.5%,Medium,5.44%,"Hash Table, Linked List, Design, Doubly-Linked List"
148,Sort List,/problems/sort-list,N,54.3%,Medium,5.39%,"Linked List, Two Pointers, Divide and Conquer, Sorting, Merge Sort"
163,Missing Ranges,/problems/missing-ranges,Y,32.0%,Easy,8.04%,No Topics Found
200,Number of Islands,/problems/number-of-islands,N,56.4%,Medium,2.98%,"Array, Depth-First Search, Breadth-First Search, Union Find, Matrix"
204,Count Primes,/problems/count-primes,N,33.1%,Medium,6.96%,"Array, Math, Enumeration, Number Theory"
207,Course Schedule,/problems/course-schedule,N,45.4%,Medium,4.56%,"Depth-First Search, Breadth-First Search, Graph, Topological Sort"
210,Course Schedule II,/problems/course-schedule-ii,N,48.0%,Medium,21.22%,"Depth-First Search, Breadth-First Search, Graph, Topological Sort"
212,Word Search II,/problems/word-search-ii,N,36.9%,Hard,3.23%,"Array, String, Backtracking, Trie, Matrix"
213,House Robber II,/problems/house-robber-ii,N,40.7%,Medium,4.63%,"Array, Dynamic Programming"
221,Maximal Square,/problems/maximal-square,N,44.6%,Medium,19.30%,"Array, Dynamic Programming, Matrix"
227,Basic Calculator II,/problems/basic-calculator-ii,N,42.2%,Medium,9.95%,"Math, String, Stack"
236,Lowest Common Ancestor of a Binary Tree,/problems/lowest-common-ancestor-of-a-binary-tree,N,58.1%,Medium,1.82%,"Tree, Depth-First Search, Binary Tree"
254,Factor Combinations,/problems/factor-combinations,Y,48.8%,Medium,18.17%,No Topics Found
261,Graph Valid Tree,/problems/graph-valid-tree,Y,46.9%,Medium,5.62%,No Topics Found
286,Walls and Gates,/problems/walls-and-gates,Y,60.3%,Medium,12.50%,No Topics Found
300,Longest Increasing Subsequence,/problems/longest-increasing-subsequence,N,51.6%,Medium,7.26%,"Array, Binary Search, Dynamic Programming"
301,Remove Invalid Parentheses,/problems/remove-invalid-parentheses,N,47.1%,Hard,13.70%,"String, Backtracking, Breadth-First Search"
322,Coin Change,/problems/coin-change,N,41.6%,Medium,20.99%,"Array, Dynamic Programming, Breadth-First Search"
323,Number of Connected Components in an Undirected Graph,/problems/number-of-connected-components-in-an-undirected-graph,Y,62.1%,Medium,11.38%,No Topics Found
329,Longest Increasing Path in a Matrix,/problems/longest-increasing-path-in-a-matrix,N,52.2%,Hard,18.67%,"Array, Dynamic Programming, Depth-First Search, Breadth-First Search, Graph, Topological Sort, Memoization, Matrix"
331,Verify Preorder Serialization of a Binary Tree,/problems/verify-preorder-serialization-of-a-binary-tree,N,44.3%,Medium,14.41%,
380,Insert Delete GetRandom O(1),/problems/insert-delete-getrandom-o1,N,52.0%,Medium,3.33%,"Array, Hash Table, Math, Design, Randomized"
387,First Unique Character in a String,/problems/first-unique-character-in-a-string,N,59.0%,Easy,1.28%,"Hash Table, String, Queue, Counting"
394,Decode String,/problems/decode-string,N,57.6%,Medium,20.31%,"String, Stack, Recursion"
486,Predict the Winner,/problems/predict-the-winner,N,50.8%,Medium,10.70%,"Array, Math, Dynamic Programming, Recursion, Game Theory"
560,Subarray Sum Equals K,/problems/subarray-sum-equals-k,N,44.0%,Medium,1.64%,"Array, Hash Table, Prefix Sum"
658,Find K Closest Elements,/problems/find-k-closest-elements,N,46.8%,Medium,8.01%,"Array, Two Pointers, Binary Search, Sliding Window, Sorting, Heap (Priority Queue)"
670,Maximum Swap,/problems/maximum-swap,N,47.9%,Medium,15.40%,"Math, Greedy"
680,Valid Palindrome II,/problems/valid-palindrome-ii,N,39.3%,Easy,6.93%,"Two Pointers, String, Greedy"
694,Number of Distinct Islands,/problems/number-of-distinct-islands,Y,60.6%,Medium,22.12%,No Topics Found
735,Asteroid Collision,/problems/asteroid-collision,N,44.4%,Medium,19.80%,"Array, Stack, Simulation"
739,Daily Temperatures,/problems/daily-temperatures,N,66.6%,Medium,5.34%,"Array, Stack, Monotonic Stack"
772,Basic Calculator III,/problems/basic-calculator-iii,Y,48.6%,Hard,28.70%,No Topics Found
785,Is Graph Bipartite?,/problems/is-graph-bipartite,N,52.7%,Medium,5.05%,"Depth-First Search, Breadth-First Search, Union Find, Graph"
787,Cheapest Flights Within K Stops,/problems/cheapest-flights-within-k-stops,N,35.9%,Medium,3.46%,"Dynamic Programming, Depth-First Search, Breadth-First Search, Graph, Heap (Priority Queue), Shortest Path"
489,Robot Room Cleaner,/problems/robot-room-cleaner,Y,76.5%,Hard,18.79%,No Topics Found
945,Minimum Increment to Make Array Unique,/problems/minimum-increment-to-make-array-unique,N,50.3%,Medium,64.39%,"Array, Greedy, Sorting, Counting"
947,Most Stones Removed with Same Row or Column,/problems/most-stones-removed-with-same-row-or-column,N,58.8%,Medium,2.72%,"Hash Table, Depth-First Search, Union Find, Graph"
968,Binary Tree Cameras,/problems/binary-tree-cameras,N,46.8%,Hard,14.22%,"Dynamic Programming, Tree, Depth-First Search, Binary Tree"
992,Subarrays with K Different Integers,/problems/subarrays-with-k-different-integers,N,54.4%,Hard,11.13%,"Array, Hash Table, Sliding Window, Counting"
993,Cousins in Binary Tree,/problems/cousins-in-binary-tree,N,54.2%,Easy,15.69%,"Tree, Depth-First Search, Breadth-First Search, Binary Tree"
994,Rotting Oranges,/problems/rotting-oranges,N,52.5%,Medium,3.90%,"Array, Breadth-First Search, Matrix"
1004,Max Consecutive Ones III,/problems/max-consecutive-ones-iii,N,63.4%,Medium,3.67%,"Array, Binary Search, Sliding Window, Prefix Sum"
1011,Capacity To Ship Packages Within D Days,/problems/capacity-to-ship-packages-within-d-days,N,64.6%,Medium,14.59%,No Topics Found
1099,Two Sum Less Than K,/problems/two-sum-less-than-k,Y,60.8%,Easy,3.03%,No Topics Found
1048,Longest String Chain,/problems/longest-string-chain,N,59.1%,Medium,6.83%,"Array, Hash Table, Two Pointers, String, Dynamic Programming, Sorting"
1249,Minimum Remove to Make Valid Parentheses,/problems/minimum-remove-to-make-valid-parentheses,N,65.7%,Medium,6.63%,"String, Stack"
1293,Shortest Path in a Grid with Obstacles Elimination,/problems/shortest-path-in-a-grid-with-obstacles-elimination,N,45.6%,Hard,8.34%,"Array, Breadth-First Search, Matrix"
1352,Product of the Last K Numbers,/problems/product-of-the-last-k-numbers,N,49.7%,Medium,28.79%,"Array, Math, Design, Queue, Data Stream"
1366,Rank Teams by Votes,/problems/rank-teams-by-votes,N,58.6%,Medium,14.41%,"Array, Hash Table, String, Sorting, Counting"
1444,Number of Ways of Cutting a Pizza,/problems/number-of-ways-of-cutting-a-pizza,N,58.0%,Hard,100.00%,"Array, Dynamic Programming, Memoization, Matrix"
2096,Step-By-Step Directions From a Binary Tree Node to Another,/problems/step-by-step-directions-from-a-binary-tree-node-to-another,N,48.8%,Medium,7.82%,"String, Tree, Depth-First Search, Binary Tree"
2115,Find All Possible Recipes from Given Supplies,/problems/find-all-possible-recipes-from-given-supplies,N,48.4%,Medium,8.93%,"Array, Hash Table, String, Graph, Topological Sort"
